{
  "object": "frontend.songs.response",
  "version": "1.0",
  "lang": "eng",
  "songs": [
    {
      "id": 1234,
      "group": "Chumbawamba",
      "authors": [
        {
          "id": 765,
          "name": "Duncan Bruce"
        },
        {
          "id": 987,
          "name": "Darren James Hamer"
        }
      ],
      "title": "Tubthumping",
      "rowsPlain": [
        "We'll be singing",
        "When we're winning",
        "We'll be singing",
        "I get knocked down",
        "But I get up again",
        "You're never gonna keep me down"
      ],
      "rowsTagged": [
        "We'll be {si}nging",
        "{When} we're {wi}nning",
        "We'll be singing",
        "I get {knock}ed down",
        "But I get {up} again",
        "You're never gonna keep me down"
      ],
      "tags": [
        {
          "id": 2,
          "name": "rock"
        },
        {
          "id": 11,
          "name": "moody"
        },
        {
          "id": 23,
          "name": "punk"
        }
      ]

    }
  ]
}
